{
  "id": "quest-board",
  "name": "Quest Board",
  "version": "1.0.0",
  "runnables": [
    {
      "id": "tool-quests-board",
      "name": "Quest Board",
      "kind": "tool",
      "config": { "slug": "ryu.quests__board" }
    },
    {
      "id": "tool-quests-update",
      "name": "Update Quest",
      "kind": "tool",
      "config": { "slug": "ryu.quests__update" }
    },
    {
      "id": "tool-quests-complete",
      "name": "Complete Quest",
      "kind": "tool",
      "config": { "slug": "ryu.quests__complete" }
    },
    {
      "id": "tool-quests-create",
      "name": "Create Quest",
      "kind": "tool",
      "config": { "slug": "ryu.quests__create" }
    }
  ],
  "contributes": {
    "widgets": [
      {
        "tool_id": "ryu.quests__board",
        "uri": "ui://widget/quest-board.html",
        "mime": "text/html+skybridge",
        "default_display_mode": "inline"
      }
    ]
  },
  "permission_grants": ["widget:render"]
}
