{
  "id": "goal",
  "name": "Goal",
  "version": "1.0.0",
  "runnables": [],
  "permission_grants": ["hook:side-model", "storage:kv"],
  "activation_events": ["*"],
  "contributes": {
    "slash_commands": [
      {
        "id": "goal.set",
        "command": "/goal",
        "description": "Pursue a goal until a judge model says it is met. Use '/goal clear' to stop."
      }
    ],
    "settings_tabs": [
      {
        "id": "goal.settings",
        "title": "Goals",
        "fields": [
          {
            "type": "model_picker",
            "pref_key": "goal-judge-model",
            "label": "Judge model"
          }
        ]
      }
    ],
    "turn_hooks": [
      {
        "id": "goal.loop",
        "on": "post_assistant_turn",
        "match": { "commands": ["/goal"], "stateful": true },
        "code": "const convId = ctx.conversation_id; if (!convId) { return { kind: 'none' }; } const rev = ctx.transcript.slice().reverse(); const lastUser = rev.find(m => m.role === 'user'); if (lastUser) { const t = (lastUser.content || '').trim(); if (t === '/goal clear' || t === '/goal stop') { await host.storage.delete(convId); return { kind: 'note', text: 'Goal cleared.' }; } if (t.indexOf('/goal ') === 0) { const condition = t.slice(6).trim(); if (condition) { await host.storage.set(convId, { condition: condition, status: 'active', turns: 0 }); return { kind: 'continue', text: 'Begin working toward this goal: ' + condition }; } } } const raw = await host.storage.get(convId); if (!raw) { return { kind: 'none' }; } let goal; try { goal = JSON.parse(raw); } catch (e) { return { kind: 'none' }; } if (!goal || !goal.condition || goal.status !== 'active') { return { kind: 'none' }; } const turns = goal.turns || 0; if (turns >= 25) { await host.storage.delete(convId); return { kind: 'note', text: 'Goal stopped after 25 turns.' }; } const transcript = ctx.transcript.map(m => m.role + ': ' + m.content).join('\\n'); const verdict = await host.sideModel({ system: 'You judge whether a goal has been met from the conversation. Answer with a single line exactly: MET: yes - <reason>  or  MET: no - <reason>.', prompt: 'Goal: ' + goal.condition + '\\n\\nConversation so far:\\n' + transcript + '\\n\\nIs the goal met?', model_pref_key: 'goal-judge-model' }); const met = /met:\\s*yes/i.test(verdict || ''); goal.turns = turns + 1; goal.last_reason = verdict; if (met) { await host.storage.delete(convId); return { kind: 'note', text: 'Goal met. ' + (verdict || '') }; } await host.storage.set(convId, goal); return { kind: 'continue', text: 'Keep working toward the goal: ' + goal.condition + '. Judge feedback: ' + (verdict || '') };"
      }
    ]
  }
}
