{
  "id": "io.ryu.gateway-budget-dial",
  "name": "Gateway Budget Dial",
  "version": "1.0.0",
  "runnables": [
    {
      "id": "tool-gateway-budget",
      "name": "Budget Meter",
      "kind": "tool",
      "config": { "slug": "ryu.gateway__budget" }
    },
    {
      "id": "tool-gateway-budget-set",
      "name": "Set Budget",
      "kind": "tool",
      "config": { "slug": "ryu.gateway__budget.set" }
    }
  ],
  "contributes": {
    "widgets": [
      {
        "tool_id": "ryu.gateway__budget",
        "uri": "ui://widget/gateway-budget-dial.html",
        "mime": "text/html+skybridge",
        "default_display_mode": "inline"
      }
    ]
  }
}
