{
  "id": "io.ryu.proof",
  "name": "Proof of Work",
  "version": "1.0.0",
  "runnables": [],
  "permission_grants": ["hook:run-agent", "storage:kv"],
  "activation_events": ["*"],
  "contributes": {
    "slash_commands": [
      {
        "id": "proof.set",
        "command": "/proof",
        "description": "Pursue a goal until an INDEPENDENT verifier agent proves — with tool-gathered evidence — that it is actually done. Stronger than /goal, which only judges the transcript. Use '/proof clear' to stop."
      }
    ],
    "settings_tabs": [
      {
        "id": "proof.settings",
        "title": "Proof of Work",
        "fields": [
          {
            "type": "model_picker",
            "pref_key": "proof-verifier-model",
            "label": "Verifier model"
          }
        ]
      }
    ],
    "turn_hooks": [
      {
        "id": "proof.loop",
        "on": "post_assistant_turn",
        "match": { "commands": ["/proof"], "stateful": true },
        "code": "const convId = ctx.conversation_id; if (!convId) { return { kind: 'none' }; } const rev = ctx.transcript.slice().reverse(); const lastUser = rev.find(m => m.role === 'user'); if (lastUser) { const t = (lastUser.content || '').trim(); if (t === '/proof clear' || t === '/proof stop') { await host.storage.delete(convId); return { kind: 'note', text: 'Proof goal cleared.' }; } if (t.indexOf('/proof ') === 0) { const condition = t.slice(7).trim(); if (condition) { await host.storage.set(convId, { condition: condition, status: 'active', turns: 0 }); return { kind: 'continue', text: 'Begin working toward this goal: ' + condition }; } } } const raw = await host.storage.get(convId); if (!raw) { return { kind: 'none' }; } let goal; try { goal = JSON.parse(raw); } catch (e) { return { kind: 'none' }; } if (!goal || !goal.condition || goal.status !== 'active') { return { kind: 'none' }; } const turns = goal.turns || 0; if (turns >= 12) { await host.storage.delete(convId); return { kind: 'note', text: 'Proof goal stopped after 12 verification rounds.' }; } const transcript = ctx.transcript.map(m => m.role + ': ' + m.content).join('\\n'); const task = 'You are an INDEPENDENT proof-of-work verifier agent. Another agent CLAIMS it accomplished a goal. Do NOT trust those claims. Your job is to PROVE, with concrete evidence you gather yourself using your tools, whether the goal was ACTUALLY achieved in the real workspace.\\n\\nGOAL TO VERIFY:\\n' + goal.condition + '\\n\\nWhat the other agent said it did (claims only \\u2014 verify, do not trust):\\n' + transcript + '\\n\\nInvestigate the real state: read the actual files, run the tests or commands, and check the outputs that would exist ONLY IF the goal were truly done. Gather specific evidence (file contents, command output, test results). Then decide.\\n\\nEnd your reply with a single final line, exactly one of:\\nVERIFIED: yes - <the concrete evidence that proves it>\\nVERIFIED: no - <what is missing or wrong, with the evidence you found>'; const verdict = await host.runAgent({ task: task, agent_id: ctx.agent_id, preset: 'code_read' }); const proven = /verified:\\s*yes/i.test(verdict || ''); goal.turns = turns + 1; goal.last_verdict = verdict; if (proven) { await host.storage.delete(convId); return { kind: 'note', text: 'Proof of work confirmed by an independent verifier agent. ' + (verdict || '') }; } await host.storage.set(convId, goal); return { kind: 'continue', text: 'An independent verifier agent inspected the actual workspace and could NOT yet prove the goal is done. Address its findings below, then it will re-verify.\\n\\nVerifier report:\\n' + (verdict || '') };"
      }
    ]
  }
}
